{
  "schema_version": "sync-dry-run-receipt.v1",
  "manifest": {
    "schema_version": "sync-handoff.v1",
    "sheet_id": "sheet_fixture_workspace_assets",
    "range_a1": "Assets!A2:H11",
    "row_scope": {
      "first_data_row": 2,
      "start_row": 2,
      "end_row": 11,
      "batch_size": 10,
      "next_cursor": null
    },
    "target": "staging",
    "target_database_id": "db_fixture_staging",
    "field_mapping": {
      "file_id": "file_id",
      "Name": "title",
      "Unit": "unit_name"
    },
    "approval_key_required": "SYNC_APPROVED_STAGING",
    "skipped_records": [
      {
        "source_row": 4,
        "reason": "missing_file_id",
        "file_id": null
      }
    ]
  },
  "batch_window": {
    "start_row": 2,
    "end_row": 11,
    "batch_size": 10,
    "next_cursor": null
  },
  "dry_run_passed": true,
  "sync_candidate_count": 2,
  "verified_count": 2,
  "synced_count": 2,
  "skipped_count": 1,
  "skipped_records": [
    {
      "source_row": 4,
      "reason": "missing_file_id",
      "file_id": null
    }
  ],
  "payload_sample": [
    {
      "file_id": "file_fixture_001",
      "properties": {
        "Name": "Fixture Asset 1",
        "Unit": "Fixture Unit"
      }
    },
    {
      "file_id": "file_fixture_002",
      "properties": {
        "Name": "Fixture Asset 2",
        "Unit": "Fixture Unit"
      }
    }
  ]
}
